{"actor":{"id":"imperator-development-root","kind":"imperator"},"attestation_id":"guildhall.committee.disciplinary-fit.definition.approved.1","contract_version":"1.0.0","correlation_id":"guildhall-committee-disciplinary-fit-definition-lifecycle","definition_ref":{"content_digest":"sha256:ff66d245403d893f8e59724ae94768867f3a9cee759243d8f3b37f0f722a32c7","definition_id":"guildhall.committee.disciplinary-fit","definition_version":"1.0.0"},"issued_at":"2026-08-11T00:00:00-04:00","reason":"Initial Guildhall Profile Definition approved for development runtime","record_digest":"sha256:c7543ff6e718a8f8727f8bbf5716e8cb48923a469cfb4a4ef4173dac713b5ee1","transition":{"to":"approved"}}
