{"actor":{"id":"guildhall.profile-registry","kind":"office_mechanic"},"attestation_id":"guildhall.committee.boundary-challenge.definition.current.1","contract_version":"1.0.0","correlation_id":"guildhall-committee-boundary-challenge-definition-lifecycle","definition_ref":{"content_digest":"sha256:9128a6149160c9aa7cdf4675aa9f831431ba65903fd52b4d4c7d0e29582022d8","definition_id":"guildhall.committee.boundary-challenge","definition_version":"1.0.0"},"issued_at":"2026-08-11T00:00:00-04:00","reason":"Initial approved Guildhall Profile Definition designated current","record_digest":"sha256:f229eb2ec990c206dc9314cb7ddad8cea3397601ce6e25597ef738f9380a4ce1","transition":{"from":"approved","prior_attestation_id":"guildhall.committee.boundary-challenge.definition.approved.1","to":"current"}}
