{"actor":{"id":"guildhall.profile-registry","kind":"office_mechanic"},"attestation_id":"guildhall.committee.composition.definition.current.1","contract_version":"1.0.0","correlation_id":"guildhall-committee-composition-definition-lifecycle","definition_ref":{"content_digest":"sha256:3b76c71dfc91a1ccaefcd42380f3b75b662a95eb5f308326511d2a773b538393","definition_id":"guildhall.committee.composition","definition_version":"1.0.0"},"issued_at":"2026-08-11T00:00:00-04:00","reason":"Initial approved Guildhall Profile Definition designated current","record_digest":"sha256:1952ecc4945b9eb9ecf81ee1c5c2654249ca9e767a4db817787be557b7a48b72","transition":{"from":"approved","prior_attestation_id":"guildhall.committee.composition.definition.approved.1","to":"current"}}
