{"actor":{"id":"guildhall.profile-registry","kind":"office_mechanic"},"attestation_id":"guildhall.committee.disciplinary-fit.definition.current.1","contract_version":"1.0.0","correlation_id":"guildhall-committee-disciplinary-fit-definition-lifecycle","definition_ref":{"content_digest":"sha256:ff66d245403d893f8e59724ae94768867f3a9cee759243d8f3b37f0f722a32c7","definition_id":"guildhall.committee.disciplinary-fit","definition_version":"1.0.0"},"issued_at":"2026-08-11T00:00:00-04:00","reason":"Initial approved Guildhall Profile Definition designated current","record_digest":"sha256:d3d3c90f099098ba972068a3a52bd3821f285649a3788ec3fd6cc3011b8a6ec7","transition":{"from":"approved","prior_attestation_id":"guildhall.committee.disciplinary-fit.definition.approved.1","to":"current"}}
