{"actor":{"id":"guildhall.profile-registry","kind":"office_mechanic"},"attestation_id":"guildhall.guildmaster.definition.current.1","contract_version":"1.0.0","correlation_id":"guildhall-guildmaster-definition-lifecycle","definition_ref":{"content_digest":"sha256:da2b8b062a4a8778c5cdea47a675748b43d6799d4151effed50250e1c4bc0e79","definition_id":"guildhall.guildmaster","definition_version":"1.0.0"},"issued_at":"2026-08-11T00:00:00-04:00","reason":"Initial approved Guildhall Profile Definition designated current","record_digest":"sha256:b1859cb3bfd37cec86bbb3e05f0795d9d6adc0d7a173a641bc879e3bd1c3f99c","transition":{"from":"approved","prior_attestation_id":"guildhall.guildmaster.definition.approved.1","to":"current"}}
