{"actor":{"id":"imperator-development-root","kind":"imperator"},"attestation_id":"guildhall.committee.composition.definition.approved.1","contract_version":"1.0.0","correlation_id":"guildhall-committee-composition-definition-lifecycle","definition_ref":{"content_digest":"sha256:3b76c71dfc91a1ccaefcd42380f3b75b662a95eb5f308326511d2a773b538393","definition_id":"guildhall.committee.composition","definition_version":"1.0.0"},"issued_at":"2026-08-11T00:00:00-04:00","reason":"Initial Guildhall Profile Definition approved for development runtime","record_digest":"sha256:6ecade47d44ed34f44664685ce3248390542a5aed57415ba93502014f5239312","transition":{"to":"approved"}}
