{"actor":{"id":"imperator-development-root","kind":"imperator"},"attestation_id":"guildhall.guildmaster.definition.approved.1","contract_version":"1.0.0","correlation_id":"guildhall-guildmaster-definition-lifecycle","definition_ref":{"content_digest":"sha256:da2b8b062a4a8778c5cdea47a675748b43d6799d4151effed50250e1c4bc0e79","definition_id":"guildhall.guildmaster","definition_version":"1.0.0"},"issued_at":"2026-08-11T00:00:00-04:00","reason":"Initial Guildhall Profile Definition approved for development runtime","record_digest":"sha256:b4c81fd135d0ecc52ba15b09f21e4b06e9ffb1e6a2405592b6140f1fa4fc4d77","transition":{"to":"approved"}}
