{"actor":{"id":"imperator-development-root","kind":"imperator"},"attestation_id":"guildhall.committee.boundary-challenge.definition.approved.1","contract_version":"1.0.0","correlation_id":"guildhall-committee-boundary-challenge-definition-lifecycle","definition_ref":{"content_digest":"sha256:9128a6149160c9aa7cdf4675aa9f831431ba65903fd52b4d4c7d0e29582022d8","definition_id":"guildhall.committee.boundary-challenge","definition_version":"1.0.0"},"issued_at":"2026-08-11T00:00:00-04:00","reason":"Initial Guildhall Profile Definition approved for development runtime","record_digest":"sha256:52ac46a562c83dffb7bf783dd66e2e20e44d226a3eefda5a1059bb6095c6ced8","transition":{"to":"approved"}}
